{
  "schema_version": "1.0.0",
  "session": {
    "id": "00000000-0000-4000-8000-000000000037",
    "context_type": "keynote",
    "language": "en",
    "slot_min": null,
    "qa_in_slot": false,
    "camera_setup": "audio_only",
    "talk_plan_id": null
  },
  "provenance": {
    "pipeline_version": "1.0.0",
    "scoring_config_version": "1.0.0",
    "stages": [
      {
        "name": "fusion_scoring",
        "version": "1.0.0",
        "duration_s": 0.0,
        "status": "ok"
      }
    ],
    "models": [
      {
        "component": "asr",
        "name": "synthetic-golden",
        "version": "synthetic-golden"
      },
      {
        "component": "scoring",
        "name": "scoring-config",
        "version": "1.0.0"
      }
    ],
    "prompts": [],
    "generated_at": "1970-01-01T00:00:00Z"
  },
  "media": {
    "duration_s": 179.91724137931033,
    "has_video": false,
    "has_audio": true,
    "speech_span_s": 179.91724137931033,
    "fps_analyzed": null
  },
  "quality": {
    "asr_mean_word_prob": 0.65,
    "snr_db": 10.0,
    "face_visible_ratio": null,
    "person_visible_ratio": null,
    "hands_visible_ratio": null,
    "face_px_median": null,
    "warnings": [
      "Background noise reduced measurement confidence.",
      "Transcription confidence is low; verify the transcript."
    ]
  },
  "overall": {
    "score": null,
    "level": null,
    "coverage": 0.0,
    "confidence": 0.0,
    "display_band": 10,
    "partial": true
  },
  "pillars": [
    {
      "id": "message",
      "score": null,
      "confidence": null,
      "categories": [
        "core_message",
        "structure",
        "opening_close",
        "clarity"
      ]
    },
    {
      "id": "story_impact",
      "score": null,
      "confidence": null,
      "categories": [
        "storytelling",
        "audience_adaptation",
        "impact"
      ]
    },
    {
      "id": "visuals",
      "score": null,
      "confidence": null,
      "categories": [
        "visual_aids"
      ]
    },
    {
      "id": "voice",
      "score": null,
      "confidence": null,
      "categories": [
        "pace_pausing",
        "vocal_variety",
        "fluency"
      ]
    },
    {
      "id": "body",
      "score": null,
      "confidence": null,
      "categories": [
        "gestures_body",
        "eye_contact",
        "facial_affect"
      ]
    },
    {
      "id": "presence_time",
      "score": null,
      "confidence": null,
      "categories": [
        "energy_presence",
        "time_management",
        "qa"
      ]
    }
  ],
  "categories": [
    {
      "id": "core_message",
      "pillar": "message",
      "applicable": false,
      "na_reason": "Content analysis was not run, so this category has no inputs.",
      "score": null,
      "level": null,
      "confidence": null,
      "confidence_label": null,
      "weight_used": 9.0,
      "capped_by_gate": null,
      "top_contributors": [],
      "evidence_ids": [],
      "sources": [
        "S2",
        "S6",
        "S7",
        "S32",
        "S33"
      ],
      "counterfactual": null
    },
    {
      "id": "structure",
      "pillar": "message",
      "applicable": false,
      "na_reason": "Content analysis was not run, so this category has no inputs.",
      "score": null,
      "level": null,
      "confidence": null,
      "confidence_label": null,
      "weight_used": 6.0,
      "capped_by_gate": null,
      "top_contributors": [],
      "evidence_ids": [],
      "sources": [
        "S7",
        "S8",
        "S10",
        "S32",
        "S33"
      ],
      "counterfactual": null
    },
    {
      "id": "storytelling",
      "pillar": "story_impact",
      "applicable": false,
      "na_reason": "Content analysis was not run, so this category has no inputs.",
      "score": null,
      "level": null,
      "confidence": null,
      "confidence_label": null,
      "weight_used": 10.0,
      "capped_by_gate": null,
      "top_contributors": [],
      "evidence_ids": [],
      "sources": [
        "S2",
        "S3",
        "S5",
        "S6",
        "S26"
      ],
      "counterfactual": null
    },
    {
      "id": "audience_adaptation",
      "pillar": "story_impact",
      "applicable": false,
      "na_reason": "Content analysis was not run, so this category has no inputs.",
      "score": null,
      "level": null,
      "confidence": null,
      "confidence_label": null,
      "weight_used": 5.0,
      "capped_by_gate": null,
      "top_contributors": [],
      "evidence_ids": [],
      "sources": [
        "S1",
        "S2",
        "S6",
        "S7",
        "S8",
        "S33"
      ],
      "counterfactual": null
    },
    {
      "id": "opening_close",
      "pillar": "message",
      "applicable": false,
      "na_reason": "Content analysis was not run, so this category has no inputs.",
      "score": null,
      "level": null,
      "confidence": null,
      "confidence_label": null,
      "weight_used": 8.0,
      "capped_by_gate": null,
      "top_contributors": [],
      "evidence_ids": [],
      "sources": [
        "S2",
        "S3",
        "S5",
        "S32"
      ],
      "counterfactual": null
    },
    {
      "id": "clarity",
      "pillar": "message",
      "applicable": false,
      "na_reason": "Content analysis was not run, so this category has no inputs.",
      "score": null,
      "level": null,
      "confidence": null,
      "confidence_label": null,
      "weight_used": 4.0,
      "capped_by_gate": null,
      "top_contributors": [],
      "evidence_ids": [],
      "sources": [
        "S6",
        "S7",
        "S8",
        "S10",
        "S33"
      ],
      "counterfactual": null
    },
    {
      "id": "impact",
      "pillar": "story_impact",
      "applicable": false,
      "na_reason": "Content analysis was not run, so this category has no inputs.",
      "score": null,
      "level": null,
      "confidence": null,
      "confidence_label": null,
      "weight_used": 8.0,
      "capped_by_gate": null,
      "top_contributors": [],
      "evidence_ids": [],
      "sources": [
        "S3",
        "S6",
        "S26"
      ],
      "counterfactual": null
    },
    {
      "id": "visual_aids",
      "pillar": "visuals",
      "applicable": false,
      "na_reason": "No slides were detected and no deck was uploaded.",
      "score": null,
      "level": null,
      "confidence": null,
      "confidence_label": null,
      "weight_used": 5.0,
      "capped_by_gate": null,
      "top_contributors": [],
      "evidence_ids": [],
      "sources": [
        "S3",
        "S4",
        "S10",
        "S11",
        "S34"
      ],
      "counterfactual": null
    },
    {
      "id": "pace_pausing",
      "pillar": "voice",
      "applicable": true,
      "na_reason": null,
      "score": null,
      "level": null,
      "confidence": 0.0,
      "confidence_label": "low",
      "weight_used": 5.0,
      "capped_by_gate": null,
      "top_contributors": [],
      "evidence_ids": [
        "ev-0002"
      ],
      "sources": [
        "S13",
        "S22",
        "S25",
        "S43"
      ],
      "counterfactual": null
    },
    {
      "id": "vocal_variety",
      "pillar": "voice",
      "applicable": true,
      "na_reason": null,
      "score": null,
      "level": null,
      "confidence": 0.0,
      "confidence_label": "low",
      "weight_used": 7.0,
      "capped_by_gate": null,
      "top_contributors": [],
      "evidence_ids": [],
      "sources": [
        "S21",
        "S22",
        "S23",
        "S24",
        "S26",
        "S33"
      ],
      "counterfactual": null
    },
    {
      "id": "fluency",
      "pillar": "voice",
      "applicable": true,
      "na_reason": null,
      "score": null,
      "level": null,
      "confidence": 0.0,
      "confidence_label": "low",
      "weight_used": 4.0,
      "capped_by_gate": null,
      "top_contributors": [],
      "evidence_ids": [
        "ev-0001"
      ],
      "sources": [
        "S12",
        "S21",
        "S22",
        "S33",
        "S14",
        "S41"
      ],
      "counterfactual": null
    },
    {
      "id": "gestures_body",
      "pillar": "body",
      "applicable": false,
      "na_reason": "Vision stage was not run; body metrics need a visible person.",
      "score": null,
      "level": null,
      "confidence": null,
      "confidence_label": null,
      "weight_used": 6.0,
      "capped_by_gate": null,
      "top_contributors": [],
      "evidence_ids": [],
      "sources": [
        "S1",
        "S16",
        "S17",
        "S18",
        "S19",
        "S26",
        "S33",
        "S34",
        "S35",
        "S36",
        "S38"
      ],
      "counterfactual": null
    },
    {
      "id": "eye_contact",
      "pillar": "body",
      "applicable": false,
      "na_reason": "Vision stage was not run; gaze metrics need a visible face.",
      "score": null,
      "level": null,
      "confidence": null,
      "confidence_label": null,
      "weight_used": 5.0,
      "capped_by_gate": null,
      "top_contributors": [],
      "evidence_ids": [],
      "sources": [
        "S1",
        "S27",
        "S33",
        "S38",
        "S49"
      ],
      "counterfactual": null
    },
    {
      "id": "facial_affect",
      "pillar": "body",
      "applicable": false,
      "na_reason": "Expression analysis is off and vision was not run.",
      "score": null,
      "level": null,
      "confidence": null,
      "confidence_label": null,
      "weight_used": 3.0,
      "capped_by_gate": null,
      "top_contributors": [],
      "evidence_ids": [],
      "sources": [
        "S26",
        "S28",
        "S29",
        "S38"
      ],
      "counterfactual": null
    },
    {
      "id": "energy_presence",
      "pillar": "presence_time",
      "applicable": false,
      "na_reason": "Energy & presence needs audio intensity trajectory or content-language inputs that are not available.",